{
  "version": 4,
  "submission_id": "e9951f55-d84f-45be-b408-2b90f12bbf26",
  "source": {
    "model": "RT-AC87U",
    "firmware": {
      "firmver": "3.0.0.4",
      "buildno": "384.13",
      "extendno": "10"
    },
    "kernel": null,
    "versions": {
      "core": "1.3.1-asus6+b61",
      "web": "0.1.4"
    }
  },
  "files": [
    {
      "type": "strategy",
      "filename": "NFQWS2_STRATEGY_2026-10-20_20-25-49Z.json",
      "byte_length": 7963,
      "sha256": "61bdd69c3a91043b9eb279c9509e8a423dc149b3ded07e249deccc69ac033782",
      "data_base64": "ewogICAgInR5cGUiOiAibmZxd3MyX3N0cmF0ZWd5IiwKICAgICJzY2hlbWFfdmVyc2lvbiI6IDIsCiAgICAidmVyc2lvbnMiOiB7CiAgICAgICAgImNvcmUiOiAiMS4zLjEtYXN1czYrYjYxIiwKICAgICAgICAid2ViIjogIjAuMS40IgogICAgfSwKICAgICJtb2RlIjogImNvbmZpZyIsCiAgICAiY29uZmlnIjogIklTUF9JTlRFUkZBQ0U9XCJcIlxuTkZRV1NfQkFTRV9BUkdTPVwiLS1ibG9iPWxpbnV4X3RsczpAUkVTT1VSQ0VfMSAtLWx1YS1pbml0PUAvb3B0L2V0Yy9uZnF3czIvbHVhL3phcHJldC1saWIubHVhIC0tbHVhLWluaXQ9QC9vcHQvZXRjL25mcXdzMi9sdWEvemFwcmV0LWFudGlkcGkubHVhIC0tbHVhLWluaXQ9QC9vcHQvZXRjL25mcXdzMi9sdWEvemFwcmV0LWF1dG8ubHVhIC0tYmxvYj1xdWljX2luaXRpYWw6QFJFU09VUkNFXzUgLS1ibG9iPXRsc19jbGllbnRoZWxsbzpAUkVTT1VSQ0VfNiAtLWx1YS1pbml0PUAvb3B0L2V0Yy9uZnF3czIvbHVhL2xvY2FsLWd1YXJkZWQtdHMubHVhXCJcbk5GUVdTX0FSR1M9XCItLWZpbHRlci10Y3A9NDQzLDgwLDE5ODQsNTIyMiAtLWZpbHRlci1sNz1odHRwLHRscyxtdHByb3RvIC0tcGF5bG9hZD10bHNfY2xpZW50X2hlbGxvLG10cHJvdG9faW5pdGlhbCAtLWx1YS1kZXN5bmM9Y2lyY3VsYXI6ZmFpbHM9Mjp0aW1lPTMwMDpyZXRyYW5zPTM6bmxkPTIgLS1sdWEtZGVzeW5jPWd1YXJkZWRfdHNfZmFrZTpibG9iPXRsc19jbGllbnRoZWxsbzp0bHNfbW9kPXJuZCxkdXBzaWQsc25pPWZvbnRzLmdvb2dsZS5jb206c3RyYXRlZ3k9MTp0Y3BfdHM9LTYwMDAwMCAtLWx1YS1kZXN5bmM9bXVsdGlzcGxpdDpwb3M9MSxtaWRzbGQ6c2Vxb3ZsPTE6c2Vxb3ZsX3BhdHRlcm49dGxzX2NsaWVudGhlbGxvOnRjcF90c191cDpzdHJhdGVneT0xIC0tbHVhLWRlc3luYz1ndWFyZGVkX3RzX2Zha2U6YmxvYj0weDAwMDAwMDAwOnRsc19tb2Q9cm5kLGR1cHNpZCxzbmk9d3d3Lmdvb2dsZS5jb206cmVwZWF0cz0yOnN0cmF0ZWd5PTI6dGNwX3RzPS02MDAwMDAgLS1sdWEtZGVzeW5jPW11bHRpc3BsaXQ6cG9zPTEsbWlkc2xkOnN0cmF0ZWd5PTIgLS1sdWEtZGVzeW5jPWhvc3RmYWtlc3BsaXQ6aG9zdD1vem9uLnJ1Om1pZGhvc3Q9aG9zdC0yOnNlcW92bD1zbmlleHQrMzpzZXFvdmxfcGF0dGVybj10bHNfY2xpZW50aGVsbG86YmFkc3VtOnRjcF9tZDU6dGNwX3RzX3VwOnN0cmF0ZWd5PTMgLS1sdWEtZGVzeW5jPWhvc3RmYWtlc3BsaXQ6dGNwX21kNTp0Y3BfdHNfdXA6c3RyYXRlZ3k9MyAtLXBheWxvYWQ9aHR0cF9yZXEgLS1sdWEtZGVzeW5jPWh0dHBfbWV0aG9kZW9sOmJhZHN1bVwiXG5ORlFXU19BUkdTX1FVSUM9XCItLWZpbHRlci11ZHA9NDQzIC0tZmlsdGVyLWw3PXF1aWMgLS1wYXlsb2FkPXF1aWNfaW5pdGlhbCAtLWx1YS1kZXN5bmM9ZmFrZTpibG9iPXF1aWNfaW5pdGlhbDpyZXBlYXRzPTExXCJcbk5GUVdTX0FSR1NfVURQPVwiLS1maWx0ZXItdWRwPTU5MC02MDAsMTQwMCwzNDc4LTM0ODEsNTM0OSwxOTI5NC0xOTM0NCw0OTE1Mi02NTUzNSAtLWZpbHRlci1sNz13aXJlZ3VhcmQsc3R1bixkaXNjb3JkLG10cHJvdG8sdW5rbm93biAtLW91dC1yYW5nZT08bjIgLS1wYXlsb2FkPXdpcmVndWFyZF9pbml0aWF0aW9uLHdpcmVndWFyZF9yZXNwb25zZSx3aXJlZ3VhcmRfY29va2llLHN0dW4sZGlzY29yZF9pcF9kaXNjb3ZlcnksbXRwcm90b19pbml0aWFsLHVua25vd24gLS1sdWEtZGVzeW5jPWNpcmN1bGFyOmZhaWxzPTI6dGltZT0zMDA6cmV0cmFucz0zOm5sZD0yIC0tbHVhLWRlc3luYz1mYWtlOmJsb2I9MHgwMDAwMDAwMDpyZXBlYXRzPTY6c3RyYXRlZ3k9MSAtLWx1YS1kZXN5bmM9ZmFrZTpibG9iPXF1aWNfaW5pdGlhbDpyZXBlYXRzPTY6c3RyYXRlZ3k9MlwiXG5NT0RFX0xJU1Q9XCItLWhvc3RsaXN0PVJFU09VUkNFXzExXCJcbk1PREVfQUxMPVwiLS1ob3N0bGlzdC1leGNsdWRlPVJFU09VUkNFXzEyXCJcbk1PREVfQVVUTz1cIi0taG9zdGxpc3Q9UkVTT1VSQ0VfMTEgLS1ob3N0bGlzdC1hdXRvPVJFU09VUkNFXzEzIC0taG9zdGxpc3QtZXhjbHVkZT1SRVNPVVJDRV8xMlwiXG5ORlFXU19FWFRSQV9BUkdTPVwiLS1ob3N0bGlzdD1SRVNPVVJDRV8xMSAtLWhvc3RsaXN0LWF1dG89UkVTT1VSQ0VfMTMgLS1ob3N0bGlzdC1leGNsdWRlPVJFU09VUkNFXzEyXCJcbk5GUVdTX0FSR1NfSVBTRVQ9XCItLWlwc2V0PVJFU09VUkNFXzE0IC0taXBzZXQtZXhjbHVkZT1SRVNPVVJDRV8xNVwiXG5ORlFXU19BUkdTX0NVU1RPTT1cIi0tZmlsdGVyLXVkcD0zNDc4IC0taXBzZXQtaXA9MTYyLjE1OS4yMDcuMC8zMiAtLWx1YS1kZXN5bmM9cGFzcyAtLW5ldyAtLWZpbHRlci10Y3A9NDQzLDg1MyAtLWZpbHRlci1sNz10bHMgLS1ob3N0bGlzdC1kb21haW5zPWRvdC5wdWIsZG9oLnB1Yixjb250cm9sZC5jb20sb3BlbmRucy5jb20sYW55Y2FzdC5jZW5zdXJmcmlkbnMuZGssZG5zLmFsaWRucy5jb20sbGlicmVkbnMuZ3IsY2xvdWRmbGFyZS1kbnMuY29tLG9uZS5vbmUub25lLm9uZSxvcGVubmFtZXNlcnZlci5vcmcsY2xlYW5icm93c2luZy5vcmcsZG5zLmFkZ3VhcmQtZG5zLmNvbSxkbnMuY29tc3Mub25lLGRucy5uZXh0ZG5zLmlvLHF1YWQ5Lm5ldCxkbnMuZ29vZ2xlLGRucy5zYixkbnMuZ2VvaGlkZS5ydSAtLWx1YS1kZXN5bmM9cGFzcyAtLW5ldyAtLWZpbHRlci10Y3A9NDQzIC0taG9zdGxpc3QtZG9tYWlucz1saW51eHNlcnZlci5pbyAtLXBheWxvYWQ9dGxzX2NsaWVudF9oZWxsbyAtLWx1YS1kZXN5bmM9Z3VhcmRlZF90c19mYWtlOmJsb2I9bGludXhfdGxzOnJlcGVhdHM9Njp0Y3BfdHM9LTYwMDAwMCAtLWx1YS1kZXN5bmM9bXVsdGlzcGxpdDpwb3M9MSwyIC0tbmV3IC0tZmlsdGVyLXRjcD00NDMgLS1ob3N0bGlzdC1kb21haW5zPXRvcnByb2plY3Qub3JnIC0tcGF5bG9hZD10bHNfY2xpZW50X2hlbGxvIC0tbHVhLWRlc3luYz1ndWFyZGVkX3RzX2Zha2U6YmxvYj10bHNfY2xpZW50aGVsbG86cmVwZWF0cz02OnRjcF90cz0tNjAwMDAwIC0tbHVhLWRlc3luYz1tdWx0aWRpc29yZGVyOnBvcz0xLG1pZHNsZCAtLW5ldyAtLWZpbHRlci10Y3A9NDQzIC0taG9zdGxpc3QtZG9tYWlucz1kaXNjb3JkLmNvbSxkaXNjb3JkLmdnLGRpc2NvcmRhcHAuY29tLGRpc2NvcmRhcHAubmV0IC0tcGF5bG9hZD10bHNfY2xpZW50X2hlbGxvIC0tbHVhLWRlc3luYz1ndWFyZGVkX3RzX2Zha2U6YmxvYj10bHNfY2xpZW50aGVsbG86dGxzX21vZD1ybmQsZHVwc2lkLHNuaT13d3cuZ29vZ2xlLmNvbTpyZXBlYXRzPTY6dGNwX3RzPS02MDAwMDAgLS1sdWEtZGVzeW5jPW11bHRpc3BsaXQ6cG9zPTEsMiAtLW5ldyAtLWZpbHRlci10Y3A9NDQzIC0taG9zdGxpc3QtZG9tYWlucz1pbnN0YWdyYW0uY29tLGNkbmluc3RhZ3JhbS5jb20sZmJjZG4ubmV0LGZhY2Vib29rLmNvbSAtLXBheWxvYWQ9dGxzX2NsaWVudF9oZWxsbyAtLWx1YS1kZXN5bmM9Z3VhcmRlZF90c19mYWtlOmJsb2I9dGxzX2NsaWVudGhlbGxvOnRsc19tb2Q9cm5kLGR1cHNpZCxzbmk9d3d3Lmdvb2dsZS5jb206cmVwZWF0cz02OnRjcF90cz0tNjAwMDAwIC0tbHVhLWRlc3luYz1tdWx0aXNwbGl0OnBvcz0xLDIgLS1uZXcgLS1maWx0ZXItdGNwPTQ0MyAtLWhvc3RsaXN0LWRvbWFpbnM9dXQ0LnRpbWlpbWl0LmNvbSxtYXN0ZXItdXQ0LnRpbWlpbWl0LmNvbSAtLXBheWxvYWQ9dGxzX2NsaWVudF9oZWxsbyAtLWx1YS1kZXN5bmM9Z3VhcmRlZF90c19mYWtlOmJsb2I9dGxzX2NsaWVudGhlbGxvOnRsc19tb2Q9cm5kLGR1cHNpZCxzbmk9d3d3Lmdvb2dsZS5jb206cmVwZWF0cz02OnRjcF90cz0tNjAwMDAwIC0tbHVhLWRlc3luYz1tdWx0aXNwbGl0OnBvcz0xLDIgLS1uZXcgLS1maWx0ZXItdGNwPTQ0MyAtLWhvc3RsaXN0LWRvbWFpbnM9YXBpLnRoZW1vdmllZGIub3JnIC0tbHVhLWRlc3luYz1wYXNzIC0tbmV3IC0tZmlsdGVyLXRjcD00NDMgLS1ob3N0bGlzdC1kb21haW5zPWltYWdlLnRtZGIub3JnIC0tcGF5bG9hZD10bHNfY2xpZW50X2hlbGxvIC0tbHVhLWRlc3luYz1ndWFyZGVkX3RzX2Zha2U6YmxvYj10bHNfY2xpZW50aGVsbG86dGxzX21vZD1ybmQsZHVwc2lkLHNuaT13d3cuZ29vZ2xlLmNvbTpyZXBlYXRzPTY6dGNwX3RzPS02MDAwMDAgLS1sdWEtZGVzeW5jPW11bHRpc3BsaXQ6cG9zPTEsMiAtLW5ldyAtLWZpbHRlci10Y3A9NDQzIC0taXBzZXQ9UkVTT1VSQ0VfMTYgLS1wYXlsb2FkPXRsc19jbGllbnRfaGVsbG8gLS1sdWEtZGVzeW5jPWd1YXJkZWRfdHNfZmFrZTpibG9iPWxpbnV4X3RsczpyZXBlYXRzPTY6dGNwX3RzPS02MDAwMDAgLS1sdWEtZGVzeW5jPW11bHRpc3BsaXQ6cG9zPTEsMiAtLW5ldyAtLWZpbHRlci10Y3A9ODAgLS1pcHNldD1SRVNPVVJDRV8xNyAtLXBheWxvYWQ9aHR0cF9yZXEgLS1sdWEtZGVzeW5jPWd1YXJkZWRfdHNfZmFrZTpibG9iPTB4NDc0NTU0MjAyZjIwNDg1NDU0NTAyZjMxMmUzMTBkMGE0ODZmNzM3NDNhMjA3Nzc3NzcyZTY3NmY2ZjY3NmM2NTJlNjM2ZjZkMGQwYTBkMGE6cmVwZWF0cz02OnRjcF90cz0tNjAwMDAwIC0tbHVhLWRlc3luYz1tdWx0aXNwbGl0OnBvcz0yIC0tbmV3IC0tZmlsdGVyLXRjcD00NDMgLS1pcHNldD1SRVNPVVJDRV8xOCAtLXBheWxvYWQ9dGxzX2NsaWVudF9oZWxsbyAtLWx1YS1kZXN5bmM9Z3VhcmRlZF90c19mYWtlOmJsb2I9dGxzX2NsaWVudGhlbGxvOnRsc19tb2Q9cm5kLGR1cHNpZCxzbmk9d3d3Lmdvb2dsZS5jb206cmVwZWF0cz02OnRjcF90cz0tNjAwMDAwIC0tbHVhLWRlc3luYz1tdWx0aXNwbGl0OnBvcz0xLDIgLS1uZXcgLS1maWx0ZXItdGNwPTQ0MyAtLWZpbHRlci1sNz10bHMgLS1wYXlsb2FkPXRsc19jbGllbnRfaGVsbG8gLS1ob3N0bGlzdD1SRVNPVVJDRV8xOSAtLWx1YS1kZXN5bmM9bXVsdGlkaXNvcmRlcjpwb3M9MSxzbmlleHQrMSxob3N0KzEsbWlkc2xkLTIsbWlkc2xkLG1pZHNsZCsyLGVuZGhvc3QtMSAtLWx1YS1kZXN5bmM9Z3VhcmRlZF90c19mYWtlOmJsb2I9dGxzX2NsaWVudGhlbGxvOnRsc19tb2Q9cm5kLGR1cHNpZCxzbmk9cnpkLnJ1OnJlcGVhdHM9NDp0Y3BfdHM9LTYwMDAwMCAtLW5ldyAtLWZpbHRlci11ZHA9ODUzIC0tZmlsdGVyLWw3PXF1aWMgLS1ob3N0bGlzdC1kb21haW5zPWRucy5hZGd1YXJkLWRucy5jb20sZG5zLm5leHRkbnMuaW8gLS1wYXlsb2FkPXF1aWNfaW5pdGlhbCAtLWx1YS1kZXN5bmM9c2VuZDppcGZyYWc6aXBmcmFnX3Bvc191ZHA9MTI4XCJcbklQVjZfRU5BQkxFRD1cIjBcIlxuVENQX1BPUlRTPVwiODAsNDQzLDE5ODQsMjA1MywyMDgzLDIwODcsMjA5Niw1MjIyLDg0NDMsODUzXCJcblVEUF9QT1JUUz1cIjQ0Myw1OTA6NjAwLDE0MDAsMzQ3ODozNDgxLDUzNDksMTkyOTQ6MTkzNDQsNDkxNTI6NjU1MzUsODUzXCJcbkFTVVNfQ0xJRU5UX01PREU9XCJhbGxcIlxuQVNVU19DTElFTlRTND1cIlwiXG5BU1VTX0NMSUVOVFM2PVwiXCJcbkxPR19MRVZFTD1cIjBcIlxuTE9HX0RFQlVHX1BBVEg9XCJSRVNPVVJDRV8yMFwiXG5ORlFVRVVFX05VTT1cIjMwMFwiXG5VU0VSPVwiPGhpZGRlbj5cIlxuQ09ORklHX1ZFUlNJT049XCIxXCJcbiIsCiAgICAib21pdHRlZF9vcHRpb25zIjogMCwKICAgICJwdXJwb3NlIjogItCU0L7QvNGA0YMiLAogICAgIm9wZXJhdG9yIjogItCU0L7QvNGA0YMiLAogICAgImNvbW1lbnQiOiAiQVVUTzog0YHRgtGA0LDRgtC10LPQuNC4IFRDUCwgUVVJQyDQuCBVRFAg0YEg0L3Rg9C20L3Ri9C80Lgg0YHQv9C40YHQutCw0LzQuCDQuCBibG9icy4gU21hcnRETlMg0L3QsNC30L3QsNGH0LDQtdGCIERvVC9Eb0gg0L7RgtC00LXQu9GM0L3Ri9C8INGB0LDQudGC0LDQvCDQuCDQt9Cw0LrRgNC10L/Qu9GP0LXRgiBJUCDQtNC70Y8gRGlzY29yZCDQuCBpbWFnZS50bWRiLm9yZy4gRE5TINC/0L7Qu9GD0YfQsNC10YIg0LDQtNGA0LXRgdCwINGB0LXRgNCy0LjRgdC+0LIsIE5GUVdTMiDQvtCx0YDQsNCx0LDRgtGL0LLQsNC10YIg0YHQvtC10LTQuNC90LXQvdC40Y8uINCf0YDQvtGE0LjQu9GMINC/0LXRgNC10L3QvtGB0LjRgiDQuCDRgdGC0YDQsNGC0LXQs9C40LgsINC4IEROUy3Rg9GB0LvQvtCy0LjRjyDQuNGFINGA0LDQsdC+0YLRiy4g0KDQtdC30YPQu9GM0YLQsNGCINC30LDQstC40YHQuNGCINC+0YIg0YHQtdGC0Lg7INCy0LjQtNC10L4sINCz0L7Qu9C+0YEg0LggSVB2NiDQv9GA0L7QstC10YDRj9GO0YLRgdGPINC+0YLQtNC10LvRjNC90L4uIiwKICAgICJkZXBlbmRlbmNpZXMiOiBbCiAgICAgICAgewogICAgICAgICAgICAiaWQiOiAiUkVTT1VSQ0VfMSIsCiAgICAgICAgICAgICJraW5kIjogImZpbGUiLAogICAgICAgICAgICAiaW5jbHVkZWQiOiB0cnVlCiAgICAgICAgfSwKICAgICAgICB7CiAgICAgICAgICAgICJpZCI6ICJSRVNPVVJDRV81IiwKICAgICAgICAgICAgImtpbmQiOiAiZmlsZSIsCiAgICAgICAgICAgICJpbmNsdWRlZCI6IHRydWUKICAgICAgICB9LAogICAgICAgIHsKICAgICAgICAgICAgImlkIjogIlJFU09VUkNFXzYiLAogICAgICAgICAgICAia2luZCI6ICJmaWxlIiwKICAgICAgICAgICAgImluY2x1ZGVkIjogdHJ1ZQogICAgICAgIH0sCiAgICAgICAgewogICAgICAgICAgICAiaWQiOiAiQkxPQl84IiwKICAgICAgICAgICAgImtpbmQiOiAiYmxvYiIsCiAgICAgICAgICAgICJpbmNsdWRlZCI6IHRydWUKICAgICAgICB9LAogICAgICAgIHsKICAgICAgICAgICAgImlkIjogIkJMT0JfOSIsCiAgICAgICAgICAgICJraW5kIjogImJsb2IiLAogICAgICAgICAgICAiaW5jbHVkZWQiOiB0cnVlCiAgICAgICAgfSwKICAgICAgICB7CiAgICAgICAgICAgICJpZCI6ICJCTE9CXzEwIiwKICAgICAgICAgICAgImtpbmQiOiAiYmxvYiIsCiAgICAgICAgICAgICJpbmNsdWRlZCI6IHRydWUKICAgICAgICB9LAogICAgICAgIHsKICAgICAgICAgICAgImlkIjogIlJFU09VUkNFXzExIiwKICAgICAgICAgICAgImtpbmQiOiAiZmlsZSIsCiAgICAgICAgICAgICJpbmNsdWRlZCI6IHRydWUKICAgICAgICB9LAogICAgICAgIHsKICAgICAgICAgICAgImlkIjogIlJFU09VUkNFXzEyIiwKICAgICAgICAgICAgImtpbmQiOiAiZmlsZSIsCiAgICAgICAgICAgICJpbmNsdWRlZCI6IHRydWUKICAgICAgICB9LAogICAgICAgIHsKI